{
  "$schema": "https://sah.dev/schemas/checker-review/v0.1.0",
  "reviewVersion": "0.1.0",
  "reviewId": "R-023-checker-a0db4a8",
  "target": {
    "targetRoot": "/Users/sungwoon/ai-projects/sah",
    "targetRevision": "git:a0db4a84a4244589aed07da870e93dc4bcc35215",
    "designFingerprint": "sha256:cc8663147472dc70644fd5feb6aabac0bfd0cc6dd4403bad7cc4ee419d9fa261"
  },
  "scope": {
    "taskRef": "R-023",
    "artifactRefs": [
      ".agent/plans/run-23.md",
      "docs/adr/0023-scenario-centered-vertical-slice-loop.md",
      "docs/iteration-loop.md",
      "schemas/iteration-scenario.schema.json",
      "schemas/iteration-slice.schema.json",
      "schemas/iteration-loop.schema.json",
      "schemas/iteration-outcome.schema.json",
      "schemas/iteration-completion.schema.json",
      "schemas/iteration-loop-result.schema.json",
      "src/iteration-loop.ts",
      "src/cli.ts",
      "src/contracts.ts",
      "src/schema-validation.ts",
      "skills/sah/SKILL.md",
      "test/iteration-loop.test.ts"
    ]
  },
  "reviewer": {
    "role": "independent-checker",
    "id": "codex-run23-independent-checker",
    "independent": true,
    "readOnly": true,
    "mutatedTarget": false,
    "benchmarkExpectationsRead": false
  },
  "checks": [
    {
      "id": "format-check",
      "classification": "deterministic",
      "command": "npm run format:check",
      "cwd": "/Users/sungwoon/ai-projects/sah",
      "status": "passed",
      "exitCode": 0,
      "evidenceRef": "local://run23-checker/format-check",
      "observed": "Prettier reported all configured source, test, fixture, and schema files formatted, including both new reusable schemas."
    },
    {
      "id": "lint",
      "classification": "deterministic",
      "command": "npm run lint",
      "cwd": "/Users/sungwoon/ai-projects/sah",
      "status": "passed",
      "exitCode": 0,
      "evidenceRef": "local://run23-checker/lint",
      "observed": "ESLint completed without findings."
    },
    {
      "id": "typecheck",
      "classification": "deterministic",
      "command": "npm run typecheck",
      "cwd": "/Users/sungwoon/ai-projects/sah",
      "status": "passed",
      "exitCode": 0,
      "evidenceRef": "local://run23-checker/typecheck",
      "observed": "Strict TypeScript no-emit check passed."
    },
    {
      "id": "schema-trace",
      "classification": "deterministic",
      "command": "npm run verify:schemas",
      "cwd": "/Users/sungwoon/ai-projects/sah",
      "status": "passed",
      "exitCode": 0,
      "evidenceRef": "local://run23-checker/schema-trace",
      "observed": "Schema compilation, examples, and writer/reader trace tests passed 4/4."
    },
    {
      "id": "full-test",
      "classification": "deterministic",
      "command": "npm test",
      "cwd": "/Users/sungwoon/ai-projects/sah",
      "status": "passed",
      "exitCode": 0,
      "evidenceRef": "local://run23-checker/full-test",
      "observed": "All 259 tests across 12 files passed; iteration-loop coverage passed 16/16, including delimiter-bearing evidence round-trip."
    },
    {
      "id": "build",
      "classification": "deterministic",
      "command": "npm run build",
      "cwd": "/Users/sungwoon/ai-projects/sah",
      "status": "passed",
      "exitCode": 0,
      "evidenceRef": "local://run23-checker/build",
      "observed": "The production TypeScript build completed successfully."
    },
    {
      "id": "scenario-adversarial-cli",
      "classification": "deterministic",
      "command": "production sah loop, loop-checks, loop-record, and loop-complete probes on disposable /tmp copies",
      "cwd": "/Users/sungwoon/ai-projects/sah",
      "status": "passed",
      "exitCode": 0,
      "evidenceRef": "local://run23-checker/scenario-adversarial-cli",
      "observed": "Legacy compatibility, unknown scenario/check rejection, missing/failed/incomplete/unowned evidence gates, stale-context atomic no-op, scenario ownership, and exit 0/1/2 boundaries behaved as specified."
    },
    {
      "id": "delimiter-evidence-cli",
      "classification": "deterministic",
      "command": "production sah loop-checks, loop-record, and loop-complete with currentIteration.id iteration:001 on a disposable /tmp copy",
      "cwd": "/Users/sungwoon/ai-projects/sah",
      "status": "passed",
      "exitCode": 0,
      "evidenceRef": "local://run23-checker/delimiter-evidence-cli",
      "observed": "Runner evidence iteration:001:reservation-e2e was accepted by the recorder and resolved for both criterionResults and scenarioResults completion."
    },
    {
      "id": "diff-check",
      "classification": "deterministic",
      "command": "git diff --check",
      "cwd": "/Users/sungwoon/ai-projects/sah",
      "status": "passed",
      "exitCode": 0,
      "evidenceRef": "local://run23-checker/diff-check",
      "observed": "No whitespace errors were reported."
    }
  ],
  "findings": [],
  "residualRisks": [
    "Scenario evidence proves deterministic execution linkage, not semantic adequacy, human acceptance, or user value.",
    "Target revision tokens are caller-supplied opaque context and are not independently derived from Git by SAH.",
    "The atomic runtime remains a local single-writer design; hosted or concurrent multi-writer coordination is intentionally excluded."
  ],
  "verdict": "approve",
  "reviewedAt": "2026-08-20T12:36:48Z"
}
